{
  "schema_version": "1.1",
  "id": "canon/mobility-service",
  "kind": "canon",
  "title": "Mobility service",
  "status": "active",
  "authority": "canonical",
  "owner": "product",
  "version": "2.0",
  "visibility": "internal",
  "scope": "products/mobility",
  "subjects": ["products/mobility-service"],
  "aliases": ["City Transport Planner", "Route Planner"],
  "relations": [
    { "type": "part_of", "target": "ecosystems/example" },
    { "type": "evolved_from", "target": "products/route-planner" },
    { "type": "decided_by", "target": "decisions/mobility-positioning" }
  ],
  "supersedes": ["canon/mobility-service@1.0"],
  "review_after": "2027-02-01",
  "tags": ["mobility", "product"]
}
